{
  "baselineId": "math-quest-art-migration-baseline",
  "version": "1.0.0",
  "schemaVersion": 1,
  "recordState": "FROZEN_REFERENCE",
  "primaryConsumer": "AI_AGENT",
  "authority": "THIS_FILE",
  "licence": {
    "spdx": "MIT",
    "scope": "Original Math Quest historical art-migration baseline, fixture joins, and sanitized structured render evidence.",
    "originalWork": true
  },
  "migrationStepId": "ART-MIG-01",
  "entryGateId": "GOVERNANCE_FOUNDATION_VALID",
  "exitGateId": "BASELINE_EVIDENCE_BOUND",
  "claimBoundary": "HISTORICAL_COMPARISON_REFERENCE_NOT_ART_APPROVAL_HUMAN_LEGIBILITY_PROOF_REAL_DEVICE_PROOF_OR_RELEASE_CERTIFICATION",
  "digestSemantics": {
    "fileDigest": "SHA256_RAW_GIT_BLOB_BYTES",
    "jsonDigest": "SHA256_CANONICAL_JSON_SORTED_OBJECT_KEYS_ARRAY_ORDER_PRESERVED",
    "gitIdentity": "SHA1_GIT_OBJECT_ID",
    "derivedDigest": "SHA256_EXACT_DERIVED_UTF8_BYTES_NO_TRAILING_NEWLINE",
    "visualDetailsDigest": "SHA256_EXACT_TIMING_FREE_RESULT_DETAILS_UTF8"
  },
  "orderingContract": [
    {
      "jsonPointer": "/authorityBindings",
      "policy": "LEXICOGRAPHIC_BY_ID"
    },
    {
      "jsonPointer": "/runtimeBindings",
      "policy": "LEXICOGRAPHIC_BY_ID"
    },
    {
      "jsonPointer": "/fixtureContract/records",
      "policy": "ORDER_ASCENDING"
    },
    {
      "jsonPointer": "/fixtureContract/exclusions",
      "policy": "LEXICOGRAPHIC_BY_FEATURE_ID"
    },
    {
      "jsonPointer": "/visualEvidence/viewports",
      "policy": "LEXICOGRAPHIC_BY_ID"
    },
    {
      "jsonPointer": "/visualEvidence/states",
      "policy": "LEXICOGRAPHIC"
    },
    {
      "jsonPointer": "/visualEvidence/results",
      "policy": "LEXICOGRAPHIC_BY_ID"
    }
  ],
  "sourceRevision": {
    "commitSha1": "cb25cf1734c0481ed0670b58137e76d312d05857",
    "parentSha1": "e4c7433e92f8571cd5c1803889eedbda20adaece",
    "treeOidSha1": "9e82db9f23a997fe5cd173d503274de5097c5c2e"
  },
  "authorityBindings": [
    {
      "id": "AUTH-ART-DESIGN",
      "path": "audit/art-design-decision-register-v1.json",
      "gitBlobOidSha1": "c0d85bbc42cb200ebb93a32cb60be05d6bb2857d",
      "rawByteSha256": "3014000f3f0ad1797459110da3e3ac496b79d98750da05beb961d08c6df0c507",
      "bytes": 77013,
      "canonicalJsonSha256": "02372941f80f174724e65770b6468d434391f1e5dd82551f06ed0f01d36a924d"
    },
    {
      "id": "AUTH-CODE-MAP",
      "path": "audit/repository-code-map-v1.json",
      "gitBlobOidSha1": "90df437816c71e5c0721dc4e0f17e1657b8e6028",
      "rawByteSha256": "1c8053eebb5b19fee3addcfb711343a04d53b4d6bd88cbdae7ef89209c941629",
      "bytes": 35743,
      "canonicalJsonSha256": "19d48a0e73c34efecbd2b914c7c3865dfd13bd44c9d73c5d2d48e2555b75882c"
    },
    {
      "id": "AUTH-CURRICULUM",
      "path": "curriculum/math-quest-manifest-v1.json",
      "gitBlobOidSha1": "dfd99c0d39425ce7da0b61c8b932e1b9e161e6a4",
      "rawByteSha256": "0873aa394e5ad1df97ac044e2db51f0e605893ccbd4940bfd6b2e740d62daf47",
      "bytes": 187467,
      "canonicalJsonSha256": "2ce40b93faa242e989837405ceec81a5fc314f289e0ec4888ea7d18403b2b018"
    },
    {
      "id": "AUTH-FEATURE-MAP",
      "path": "curriculum/math-quest-feature-map-v1.json",
      "gitBlobOidSha1": "983b492df8ac9f9c7ba3a7ce57ab0b06439d0ac0",
      "rawByteSha256": "0df8dab54d5d827eb7dd4e23fada9bf1b4c7f1e2250df9cc2cc1f5cc13336d3b",
      "bytes": 48939,
      "canonicalJsonSha256": "a6835c74f3903937f682ce2362b387661ae6f29eaf611ded876ed8a169f18adf"
    },
    {
      "id": "AUTH-GATE-POLICY",
      "path": "audit/gate-integrity-policy-v1.json",
      "gitBlobOidSha1": "c8122e242a4137c68cb6eced6eb15c473fb86a22",
      "rawByteSha256": "80aae938059203af7ee2b80d1ab2e43fd101a23ee38cb1873d0d6f9453b621e4",
      "bytes": 24527,
      "canonicalJsonSha256": "a3d52fe59674c3ad923749ba929f37c9780b9409631dc0c23c8788bcdb415387"
    },
    {
      "id": "AUTH-TUTORIAL-MANIFEST",
      "path": "curriculum/math-quest-tutorial-manifest-v1.json",
      "gitBlobOidSha1": "f1b76c4bf43fdce2ff2645f9b7c30f94c706a007",
      "rawByteSha256": "c04d6cb95e6bf9f5506107c8104ae69964f0f63565a11a67dcca4b8462e2ea44",
      "bytes": 73387,
      "canonicalJsonSha256": "e4cc88b1f03b21c761db29d0a22f1d30698d464a8d152f3e03af1bb3b221c149"
    }
  ],
  "runtimeBindings": [
    {
      "id": "RUNTIME-AUDIT-HARNESS",
      "path": "audit.html",
      "gitBlobOidSha1": "69280ab216e037006df3cdab8689542be4608972",
      "rawByteSha256": "49acf4892c5e171518159d8d9b38851945523f35fa8f8e3d12b74ab37fee1189",
      "bytes": 426803,
      "canonicalJsonSha256": null
    },
    {
      "id": "RUNTIME-BROWSER-ORCHESTRATOR",
      "path": "audit/lib/browser-smoke.mjs",
      "gitBlobOidSha1": "2507f20a92b1281d90645821787ff146fe0ca163",
      "rawByteSha256": "e0a7d0096fcc92c7d8cd60e06f0cfbf969a11947850b54fb28fd97d2b04f098f",
      "bytes": 39278,
      "canonicalJsonSha256": null
    },
    {
      "id": "RUNTIME-DEEP-UX-CONTRACT",
      "path": "audit/lib/playwright-deep-ux-census.mjs",
      "gitBlobOidSha1": "5a1a2c040675700d4c807bac792f9af4feae129b",
      "rawByteSha256": "211fbdb506fec73253a03857576693fbf589e14be69af42959c05c30bae50762",
      "bytes": 26964,
      "canonicalJsonSha256": null
    },
    {
      "id": "RUNTIME-INDEX",
      "path": "index.html",
      "gitBlobOidSha1": "0df7cff30b5ec204c1a73843eca45d802ddcb0cb",
      "rawByteSha256": "63f3accf255f15345996978002de7b0bc737d755f643819096d91fc4dc4365c0",
      "bytes": 1237333,
      "canonicalJsonSha256": null
    },
    {
      "id": "RUNTIME-PWA-SHELL",
      "path": "release-shell-v1.json",
      "gitBlobOidSha1": "dcb46afce03570d133371250c3751faf1244ab12",
      "rawByteSha256": "0d4b1a33b98ee6b10fe2146f3ea72feeb88679f6b6daf23615f646bbc494cf81",
      "bytes": 3238,
      "canonicalJsonSha256": "7c89b1fa48f66158655f5a0ebc5b6ceccbbc51d199c14842a02e42d2e6ba92fd"
    },
    {
      "id": "RUNTIME-SERVICE-WORKER",
      "path": "sw.js",
      "gitBlobOidSha1": "0233de6f4e90a0bcdc169288801ed5e226d7b5f3",
      "rawByteSha256": "a1db75ecdb1d3bc2fa55f42aed551eb41e32b66560a7f55a67363a63067fc4a0",
      "bytes": 17354,
      "canonicalJsonSha256": null
    },
    {
      "id": "RUNTIME-VISUAL-ORACLE",
      "path": "audit/approved-visual-regression.js",
      "gitBlobOidSha1": "6354fc5ce00ae158cea43c1d53b47e7c68ee12f8",
      "rawByteSha256": "2cf1a843a2a770ca5feae653d8349a3c2078875907f5e4737085f8c2b6965bb0",
      "bytes": 184444,
      "canonicalJsonSha256": null
    }
  ],
  "engineBinding": {
    "id": "DERIVED-ENGINE",
    "sourceBindingId": "RUNTIME-INDEX",
    "derivation": "ENGINE_MARKER_RAW_BYTES",
    "bytes": 598281,
    "rawByteSha256": "7edcb5b8855970b97139ef377d5f847f5145f196eacc4467319e08b0dee2e213"
  },
  "fixtureContract": {
    "contractId": "qa-tour-v1",
    "authorityPath": "index.html#QA_TOUR_V1",
    "seed": 1363235889,
    "generatorContractVersion": "question-generator-v6",
    "sampleKeyVersion": "manifest-skill-task-stimulus-response-answer-v2",
    "declarationBytes": 1673,
    "declarationSha256": "4b69dda64c3583466501652e65ca73605e357e81c21ec1d98d8575e7df07e88f",
    "evaluatedSpecBytes": 6477,
    "evaluatedSpecSha256": "c7582b185721f36a2232b883c2bd28724feb593a093c1e95ba1f60b2e7e5d548",
    "fullIdentityRowsBytes": 72251,
    "fullIdentityRowsSha256": "da665f8956bd58ded9857a061d68584bdb6fa546be037e9334aada7cf168ea94",
    "storedRecordSetSha256": "83e6beb7f53d99cd57c1c14fad55ebd79bad0c0ef0ae7062e61ebac82fb375cb",
    "records": [
      {
        "id": "ART-FIX-001",
        "order": 1,
        "skillId": "MQ-001",
        "featureId": "child.mechanic.pair-link",
        "level": 1,
        "strand": "amount-order",
        "generatorProfile": "quantity-identify",
        "tier": "HARD/TARGET",
        "representation": "PICTORIAL",
        "theme": "forest",
        "ordinal": 0,
        "inputMethod": "PAIR_LINK",
        "taskType": "pair-each-object",
        "semanticPromptStringId": "question.pairObjects",
        "questionId": "MQ-001-0-664147248",
        "sampleKeySha256": "66e0888aff948d3dbd49ab17af7c93fa0bdf163c15ee607119b5fceb29ca07d8",
        "tutorialFamilyId": "CHOOSE_COMPARE_CLASSIFY",
        "tutorialAnchorRoleIds": [
          "CHOOSE_NOTICE",
          "CHOOSE_PLAN",
          "CHOOSE_CHECK"
        ],
        "tutorialVisualCueIds": [
          "NOTICE_SPOTLIGHT",
          "PLAN_SEQUENCE",
          "CHECK_VERIFY"
        ],
        "tutorialObligationKey": "MQ-001|pair-each-object"
      },
      {
        "id": "ART-FIX-002",
        "order": 2,
        "skillId": "MQ-002",
        "featureId": "child.mechanic.count-touch",
        "level": 1,
        "strand": "amount-order",
        "generatorProfile": "quantity-identify",
        "tier": "HARD/TARGET",
        "representation": "PICTORIAL",
        "theme": "forest",
        "ordinal": 0,
        "inputMethod": "COUNT_TOUCH",
        "taskType": "count-a-set-to-three",
        "semanticPromptStringId": "question.countSet",
        "questionId": "MQ-002-0-1101913294",
        "sampleKeySha256": "7ae33805e8fbb0448b2e97a49cdc97e1eb9a478c5b5bd88e483fb053aa17de9f",
        "tutorialFamilyId": "COUNT_SEQUENCE_POSITION",
        "tutorialAnchorRoleIds": [
          "COUNT_NOTICE",
          "COUNT_PLAN",
          "COUNT_CHECK"
        ],
        "tutorialVisualCueIds": [
          "NOTICE_SPOTLIGHT",
          "PLAN_SEQUENCE",
          "CHECK_VERIFY"
        ],
        "tutorialObligationKey": "MQ-002|count-a-set-to-three"
      },
      {
        "id": "ART-FIX-003",
        "order": 3,
        "skillId": "MQ-040",
        "featureId": "child.mechanic.strategy-build",
        "level": 7,
        "strand": "operation-systems",
        "generatorProfile": "operation-fluency",
        "tier": "HARD/TARGET",
        "representation": "PICTORIAL",
        "theme": "forest",
        "ordinal": 0,
        "inputMethod": "STRATEGY_BUILD",
        "taskType": "add-by-counting-on",
        "semanticPromptStringId": "question.addition",